key,date,team,name,notes
NetoR20181215,2018-12-15, Jazz,Raulzinho Neto, activated from IL
BullockR20181215,2018-12-15, Pistons,Reggie Bullock, activated from IL
HartensteinI20181215,2018-12-15, Rockets,Isaiah Hartenstein, activated from IL
BookerD20181215,2018-12-15, Suns,Devin Booker, activated from IL
ButlerJ20181216,2018-12-16, 76ers,Jimmy Butler, activated from IL
WadeD20181216,2018-12-16, Heat,Dwyane Wade, returned to lineup
ThomasL20181216,2018-12-16, Knicks,Lance Thomas, activated from IL
BurkeT20181216,2018-12-16, Knicks,Trey Burke, activated from IL
GrahamT20181216,2018-12-16, Nets,Treveon Graham, activated from IL
MooreE20181216,2018-12-16, Pelicans,E'Twaun Moore, activated from IL
McRaeJ20181216,2018-12-16, Wizards,Jordan McRae, activated from IL
WilsonD20181217,2018-12-17, Bucks,D.J. Wilson, activated from IL
MiddletonK20181217,2018-12-17, Bucks,Khris Middleton, returned to lineup
AndersonK20181217,2018-12-17, Grizzlies,Kyle Anderson, activated from IL
WatanabeY20181217,2018-12-17, Grizzlies,Yuta Watanabe, returned to lineup
LabissiereS20181217,2018-12-17, Kings,Skal Labissiere, activated from IL
PachuliaZ20181217,2018-12-17, Pistons,Zaur Pachulia, activated from IL
ChrissM20181217,2018-12-17, Rockets,Marquese Chriss, returned to lineup
GibsonT20181217,2018-12-17, Timberwolves,Taj Gibson, activated from IL
IguodalaA20181217,2018-12-17, Warriors,Andre Iguodala, activated from IL
LivingstonS20181217,2018-12-17, Warriors,Shaun Livingston, activated from IL
QiZ20181217,2018-12-17, Rockets,Zhou Qi, returned to lineup
JuanJ20181218,2018-12-18, Mavericks,Jose Juan Barea, activated from IL
EvansT20181218,2018-12-18, Pacers,Tyreke Evans, activated from IL
ArizaT20181218,2018-12-18, Wizards,Trevor Ariza, activated from IL
BrogdonM20181219,2018-12-19, Bucks,Malcolm Brogdon, activated from IL
ClarksonJ20181219,2018-12-19, Cavaliers,Jordan Clarkson, returned to lineup
ParsonsC20181219,2018-12-19, Grizzlies,Chandler Parsons, activated from IL
ConleyM20181219,2018-12-19, Grizzlies,Mike Conley Jr., activated from IL
DotsonD20181219,2018-12-19, Knicks,Damyean Dotson, returned to lineup
HardawayT20181219,2018-12-19, Knicks,Tim Hardaway Jr., returned to lineup
VanVleetF20181219,2018-12-19, Raptors,Fred VanVleet, activated from IL
PowellN20181219,2018-12-19, Raptors,Norman Powell, returned to lineup
SiakamP20181219,2018-12-19, Raptors,Pascal Siakam, returned to lineup
HartensteinI20181219,2018-12-19, Rockets,Isaiah Hartenstein, activated from IL
OubreK20181219,2018-12-19, Suns,Kelly Oubre Jr., activated from IL
BaylessJ20181219,2018-12-19, Timberwolves,Jerryd Bayless, activated from IL
WilliamsL20181220,2018-12-20, Clippers,Louis Williams, activated from IL
KleberM20181220,2018-12-20, Mavericks,Maximilian Kleber, activated from IL
DellavedovaM20181221,2018-12-21, Cavaliers,Matthew Dellavedova, returned to lineup
YabuseleG20181221,2018-12-21, Celtics,Guerschon Yabusele, activated from IL
WatanabeY20181221,2018-12-21, Grizzlies,Yuta Watanabe, activated from IL
DorseyT20181221,2018-12-21, Hawks,Tyler Dorsey, activated from IL
BogdanovicB20181221,2018-12-21, Kings,Bogdan Bogdanovic, returned to lineup
ShumpertI20181221,2018-12-21, Kings,Iman Shumpert, activated from IL
IngramB20181221,2018-12-21, Lakers,Brandon Ingram, activated from IL
RondoR20181221,2018-12-21, Lakers,Rajon Rondo, activated from IL
FrazierM20181221,2018-12-21, Magic,Melvin Frazier Jr., returned to lineup
VucevicN20181221,2018-12-21, Magic,Nikola Vucevic, returned to lineup
ClarkI20181221,2018-12-21, Pelicans,Ian Clark, returned to lineup
RandleJ20181221,2018-12-21, Pelicans,Julius Randle, activated from IL
BoldenJ20181222,2018-12-22, 76ers,Jonah Bolden, activated from IL
WinslowJ20181222,2018-12-22, Heat,Justise Winslow, returned to lineup
BroekhoffR20181222,2018-12-22, Mavericks,Ryan Broekhoff, returned to lineup
GreenD20181222,2018-12-22, Raptors,Danny Green, returned to lineup
LowryK20181222,2018-12-22, Raptors,Kyle Lowry, activated from IL
PayneC20181223,2018-12-23, Bulls,Cameron Payne, returned to lineup
ParkerJ20181223,2018-12-23, Bulls,Jabari Parker, activated from IL
HorfordA20181223,2018-12-23, Celtics,Al Horford, activated from IL
MorrisM20181223,2018-12-23, Celtics,Marcus Morris, activated from IL
RobinsonJ20181223,2018-12-23, Clippers,Jerome Robinson, returned to lineup
BrooksD20181223,2018-12-23, Grizzlies,Dillon Brooks, activated from IL
PoythressA20181223,2018-12-23, Hawks,Alex Poythress, activated from IL
GilesH20181223,2018-12-23, Kings,Harry Giles, activated from IL
SimmonsJ20181223,2018-12-23, Magic,Jonathon Simmons, activated from IL
WallJ20181223,2018-12-23, Wizards,John Wall (Hildred), returned to lineup
ChandlerW20181225,2018-12-25, 76ers,Wilson Chandler, activated from IL
DiVincenzoD20181225,2018-12-25, Bucks,Donte DiVincenzo, activated from IL
TrierA20181225,2018-12-25, Knicks,Allonzo Trier, activated from IL
ChandlerT20181225,2018-12-25, Lakers,Tyson Chandler, returned to lineup
RiversA20181225,2018-12-25, Rockets,Austin Rivers, activated from IL
HartensteinI20181225,2018-12-25, Rockets,Isaiah Hartenstein, activated from IL
LaVineZ20181226,2018-12-26, Bulls,Zach LaVine, activated from IL
HoodR20181226,2018-12-26, Cavaliers,Rodney Hood, activated from IL
NoahJ20181226,2018-12-26, Grizzlies,Joakim Noah, activated from IL
CasspiO20181226,2018-12-26, Grizzlies,Omri Casspi, activated from IL
CollinsJ20181226,2018-12-26, Hawks,John Collins (Martin), activated from IL
SpellmanO20181226,2018-12-26, Hawks,Omari Spellman, activated from IL
McGruderR20181226,2018-12-26, Heat,Rodney McGruder, activated from IL
EvansT20181226,2018-12-26, Pacers,Tyreke Evans, activated from IL
LeonardK20181226,2018-12-26, Raptors,Kawhi Leonard, activated from IL
IbakaS20181226,2018-12-26, Raptors,Serge Ibaka, returned to lineup
WalkerL20181226,2018-12-26, Spurs,Lonnie Walker IV, returned to lineup
RoseD20181226,2018-12-26, Timberwolves,Derrick Rose, activated from IL
EvansJ20181227,2018-12-27, Warriors,Jacob Evans, activated from IL
SmithD20181228,2018-12-28, Mavericks,Dennis Smith Jr., activated from IL
GrahamT20181228,2018-12-28, Nets,Treveon Graham, activated from IL
O'QuinnK20181228,2018-12-28, Pacers,Kyle O'Quinn, returned to lineup
BoucherC20181228,2018-12-28, Raptors,Chris Boucher, returned to lineup
BoucherC20181228,2018-12-28, Raptors,Chris Boucher, activated from IL
GasolP20181228,2018-12-28, Spurs,Pau Gasol, activated from IL
CrawfordJ20181228,2018-12-28, Suns,Jamal Crawford, returned to lineup
McRaeJ20181228,2018-12-28, Wizards,Jordan McRae, activated from IL
LenA20181229,2018-12-29, Hawks,Alex Len, returned to lineup
PlumleeM20181229,2018-12-29, Hawks,Miles Plumlee, activated from IL
BiyomboB20181229,2018-12-29, Hornets,Bismack Biyombo, activated from IL
HardawayT20181229,2018-12-29, Knicks,Tim Hardaway Jr., activated from IL
MillsapP20181229,2018-12-29, Nuggets,Paul Millsap, activated from IL
EvansJ20181229,2018-12-29, Warriors,Jacob Evans, returned to lineup
MorrisM20181229,2018-12-29, Wizards,Markieff Morris, activated from IL
HaslemU20181230,2018-12-30, Heat,Udonis Haslem, returned to lineup
McGeeJ20181230,2018-12-30, Lakers,JaVale McGee, returned to lineup
RobinsonG20181230,2018-12-30, Pistons,Glenn Robinson III, returned to lineup
PowellN20181230,2018-12-30, Raptors,Norman Powell, returned to lineup
GeorgeP20181230,2018-12-30, Thunder,Paul George, returned to lineup
Tony(20181231,2018-12-31, Hornets,(William) Tony Parker, activated from IL
MatthewsW20181231,2018-12-31, Mavericks,Wesley Matthews, activated from IL
DialloC20181231,2018-12-31, Pelicans,Cheick Diallo, returned to lineup
MillerD20181231,2018-12-31, Pelicans,Darius Miller, activated from IL
PaytonE20181231,2018-12-31, Pelicans,Elfrid Payton, activated from IL
KnightB20181231,2018-12-31, Rockets,Brandon Knight, activated from IL
FergusonT20181231,2018-12-31, Thunder,Terrance Ferguson, returned to lineup
EmbiidJ20190101,2019-01-01, 76ers,Joel Embiid, returned to lineup
TrentG20190101,2019-01-01, Blazers,Gary Trent Jr., activated from IL
HarklessM20190101,2019-01-01, Blazers,Maurice Harkless, activated from IL
CrowderJ20190101,2019-01-01, Jazz,Jae Crowder, activated from IL
RubioR20190101,2019-01-01, Jazz,Ricky Rubio, activated from IL
HarrisG20190101,2019-01-01, Nuggets,Gary Harris, activated from IL
HoodR20190102,2019-01-02, Cavaliers,Rodney Hood, returned to lineup
ThompsonT20190102,2019-01-02, Cavaliers,Tristan Thompson, activated from IL
RabbI20190102,2019-01-02, Grizzlies,Ivan Rabb, activated from IL
DedmonD20190102,2019-01-02, Hawks,Dewayne Dedmon, activated from IL
WaitersD20190102,2019-01-02, Heat,Dion Waiters, activated from IL
JohnsonJ20190102,2019-01-02, Heat,James Johnson, returned to lineup
AugustineD20190102,2019-01-02, Magic,D.J. Augustine, returned to lineup
DavisA20190102,2019-01-02, Pelicans,Anthony Davis, returned to lineup
JacksonF20190102,2019-01-02, Pelicans,Frank Jackson, activated from IL
JohnsonS20190102,2019-01-02, Pistons,Stanley Johnson, returned to lineup
HolmesR20190102,2019-01-02, Suns,Richaun Holmes, activated from IL
Bates-DiopK20190102,2019-01-02, Timberwolves,Keita Bates-Diop, returned to lineup
PorterO20190102,2019-01-02, Wizards,Otto Porter Jr., activated from IL
LowryK20190103,2019-01-03, Raptors,Kyle Lowry, activated from IL
EnnisJ20190103,2019-01-03, Rockets,James Ennis, activated from IL
GayR20190103,2019-01-03, Spurs,Rudy Gay, returned to lineup
EvansJ20190103,2019-01-03, Warriors,Jacob Evans, activated from IL
IlyasovaE20190104,2019-01-04, Bucks,Ersan Ilyasova, activated from IL
WadeD20190104,2019-01-04, Heat,Dwyane Wade, returned to lineup
BeasleyM20190104,2019-01-04, Lakers,Michael Beasley, returned to lineup
SimmonsJ20190104,2019-01-04, Magic,Jonathon Simmons, activated from IL
BirchK20190104,2019-01-04, Magic,Khem Birch, returned to lineup
GrahamT20190104,2019-01-04, Nets,Treveon Graham, activated from IL
TeagueJ20190104,2019-01-04, Timberwolves,Jeff Teague, activated from IL
MiltonS20190105,2019-01-05, 76ers,Shake Milton, activated from IL
PortisB20190106,2019-01-06, Bulls,Bobby Portis, returned to lineup
SpellmanO20190106,2019-01-06, Hawks,Omari Spellman, activated from IL
LowryK20190106,2019-01-06, Raptors,Kyle Lowry, returned to lineup
HarklessM20190107,2019-01-07, Blazers,Maurice Harkless, returned to lineup
IrvingK20190107,2019-01-07, Celtics,Kyrie Irving, activated from IL
MorrisM20190107,2019-01-07, Celtics,Marcus Morris, activated from IL
WilliamsR20190107,2019-01-07, Celtics,Robert Williams III, activated from IL
WatanabeY20190107,2019-01-07, Grizzlies,Yuta Watanabe, activated from IL
BagleyM20190107,2019-01-07, Kings,Marvin Bagley III, activated from IL
KuzmaK20190107,2019-01-07, Lakers,Kyle Kuzma, returned to lineup
HarrisD20190107,2019-01-07, Mavericks,Devin Harris, returned to lineup
JuanJ20190107,2019-01-07, Mavericks,Jose Juan Barea, activated from IL
AnigboguI20190107,2019-01-07, Pacers,Ike Anigbogu, returned to lineup
ButlerJ20190108,2019-01-08, 76ers,Jimmy Butler, activated from IL
ChandlerW20190108,2019-01-08, 76ers,Wilson Chandler, activated from IL
ZizicA20190108,2019-01-08, Cavaliers,Ante Zizic, activated from IL
DellavedovaM20190108,2019-01-08, Cavaliers,Matthew Dellavedova, returned to lineup
LambJ20190108,2019-01-08, Hornets,Jeremy Lamb, returned to lineup
JohnsonA20190108,2019-01-08, Pacers,Alize Johnson, activated from IL
SumnerE20190108,2019-01-08, Pacers,Edmond Sumner, activated from IL
LeonardK20190108,2019-01-08, Raptors,Kawhi Leonard, activated from IL
RoseD20190108,2019-01-08, Timberwolves,Derrick Rose, activated from IL
RedickJ20190109,2019-01-09, 76ers,J.J. Redick, activated from IL
WilsonD20190109,2019-01-09, Bucks,D.J. Wilson, activated from IL
HoodR20190109,2019-01-09, Cavaliers,Rodney Hood, activated from IL
HuerterK20190109,2019-01-09, Hawks,Kevin Huerter, returned to lineup
MejriS20190109,2019-01-09, Mavericks,Salah Mejri, activated from IL
CarrollD20190109,2019-01-09, Nets,DeMarre Carroll, returned to lineup
HarrisJ20190109,2019-01-09, Nets,Joe Harris, activated from IL
MiroticN20190109,2019-01-09, Pelicans,Nikola Mirotic, activated from IL
McRaeJ20190109,2019-01-09, Wizards,Jordan McRae, activated from IL
ShumpertI20190110,2019-01-10, Kings,Iman Shumpert, activated from IL
HarrisG20190110,2019-01-10, Nuggets,Gary Harris, activated from IL
GayR20190110,2019-01-10, Spurs,Rudy Gay, activated from IL
RedickJ20190111,2019-01-11, 76ers,J.J. Redick, returned to lineup
WoodC20190111,2019-01-11, Bucks,Christian Wood, returned to lineup
WilsonD20190111,2019-01-11, Bucks,D.J. Wilson, returned to lineup
HoodR20190111,2019-01-11, Cavaliers,Rodney Hood, returned to lineup
NowitzkiD20190111,2019-01-11, Mavericks,Dirk Nowitzki, returned to lineup
MilesC20190111,2019-01-11, Raptors,C.J. Miles, returned to lineup
RichardsonM20190111,2019-01-11, Raptors,Malachi Richardson, activated from IL
RoseD20190111,2019-01-11, Timberwolves,Derrick Rose, returned to lineup
LivingstonS20190111,2019-01-11, Warriors,Shaun Livingston, activated from IL
AllenG20190112,2019-01-12, Jazz,Grayson Allen, returned to lineup
FrazierM20190112,2019-01-12, Magic,Melvin Frazier Jr., activated from IL
BartonW20190112,2019-01-12, Nuggets,Will Barton, returned to lineup
MooreE20190112,2019-01-12, Pelicans,E'Twaun Moore, activated from IL
GriffinB20190112,2019-01-12, Pistons,Blake Griffin, activated from IL
PachuliaZ20190112,2019-01-12, Pistons,Zaur Pachulia, activated from IL
EmbiidJ20190113,2019-01-13, 76ers,Joel Embiid, activated from IL
AntetokounmpoG20190113,2019-01-13, Bucks,Giannis Antetokounmpo, activated from IL
PrinceT20190113,2019-01-13, Hawks,Taurean Prince, activated from IL
NtilikinaF20190113,2019-01-13, Knicks,Frank Ntilikina, activated from IL
McCawP20190113,2019-01-13, Raptors,Patrick McCaw, activated from IL
EvansJ20190113,2019-01-13, Warriors,Jacob Evans, activated from IL
Tony(20190114,2019-01-14, Hornets,(William) Tony Parker, activated from IL
SmithI20190114,2019-01-14, Pistons,Ishmael Smith, activated from IL
HartensteinI20190114,2019-01-14, Rockets,Isaiah Hartenstein, activated from IL
GayR20190114,2019-01-14, Spurs,Rudy Gay, activated from IL
JohnsonA20190115,2019-01-15, 76ers,Amir Johnson, returned to lineup
PortisB20190115,2019-01-15, Bulls,Bobby Portis, returned to lineup
AdamsJ20190115,2019-01-15, Hawks,Jaylen Adams, activated from IL
WhitesideH20190115,2019-01-15, Heat,Hassan Whiteside, returned to lineup
LylesT20190115,2019-01-15, Nuggets,Trey Lyles, activated from IL
TurnerM20190115,2019-01-15, Pacers,Myles Turner, activated from IL
BookerD20190115,2019-01-15, Suns,Devin Booker, activated from IL
RoseD20190115,2019-01-15, Timberwolves,Derrick Rose, activated from IL
BaynesA20190116,2019-01-16, Celtics,Aron Baynes, activated from IL
IrvingK20190116,2019-01-16, Celtics,Kyrie Irving, activated from IL
SmartM20190116,2019-01-16, Celtics,Marcus Smart, activated from IL
Hollis-JeffersonR20190116,2019-01-16, Nets,Rondae Hollis-Jefferson, returned to lineup
NapierS20190116,2019-01-16, Nets,Shabazz Napier, returned to lineup
PachuliaZ20190116,2019-01-16, Pistons,Zaur Pachulia, activated from IL
VanVleetF20190116,2019-01-16, Raptors,Fred VanVleet, returned to lineup
GordonE20190116,2019-01-16, Rockets,Eric Gordon, activated from IL
BelinelliM20190116,2019-01-16, Spurs,Marco Belinelli, returned to lineup
GayR20190116,2019-01-16, Spurs,Rudy Gay, returned to lineup
RobinsonM20190117,2019-01-17, Knicks,Mitchell Robinson, activated from IL
HardawayT20190117,2019-01-17, Knicks,Tim Hardaway Jr., returned to lineup
HarrisG20190117,2019-01-17, Nuggets,Gary Harris, activated from IL
MilesC20190117,2019-01-17, Raptors,C.J. Miles, returned to lineup
BoucherC20190117,2019-01-17, Raptors,Chris Boucher, activated from IL
NoelN20190117,2019-01-17, Thunder,Nerlens Noel, activated from IL
HarklessM20190118,2019-01-18, Blazers,Maurice Harkless, returned to lineup
BambaM20190118,2019-01-18, Magic,Mohamed Bamba, activated from IL
ThomasK20190118,2019-01-18, Pistons,Khyri Thomas, returned to lineup
CousinsD20190118,2019-01-18, Warriors,DeMarcus Cousins, activated from IL
DiVincenzoD20190119,2019-01-19, Bucks,Donte DiVincenzo, activated from IL
WilliamsR20190119,2019-01-19, Celtics,Robert Williams III, activated from IL
DedmonD20190119,2019-01-19, Hawks,Dewayne Dedmon, activated from IL
LinJ20190119,2019-01-19, Hawks,Jeremy Lin, activated from IL
DorseyT20190119,2019-01-19, Hawks,Tyler Dorsey, activated from IL
RichardsonJ20190119,2019-01-19, Heat,Josh Richardson, returned to lineup
BartonW20190119,2019-01-19, Nuggets,Will Barton, activated from IL
LeuerJ20190119,2019-01-19, Pistons,Jon Leuer, activated from IL
RichardsonM20190119,2019-01-19, Raptors,Malachi Richardson, activated from IL
EnnisJ20190119,2019-01-19, Rockets,James Ennis, activated from IL
EllensonH20190119,2019-01-19, Pistons,Henry Ellenson, activated from IL
DeRozanD20190120,2019-01-20, Spurs,DeMar DeRozan, returned to lineup
CrawfordJ20190120,2019-01-20, Suns,Jamal Crawford, returned to lineup
CrawfordJ20190120,2019-01-20, Suns,Jamal Crawford, returned to lineup
WilliamsL20190120,2019-01-20, Clippers,Louis Williams, activated from IL
AntetokounmpoK20190121,2019-01-21, 76ers,Kostas Antetokounmpo, activated from IL
HaywardG20190121,2019-01-21, Celtics,Gordon Hayward, activated from IL
GasolM20190121,2019-01-21, Grizzlies,Marc Gasol, returned to lineup
RubioR20190121,2019-01-21, Jazz,Ricky Rubio, activated from IL
KanterE20190121,2019-01-21, Knicks,Enes Kanter, activated from IL
FrazierM20190121,2019-01-21, Magic,Melvin Frazier Jr., activated from IL
KnightB20190121,2019-01-21, Rockets,Brandon Knight, activated from IL
AbrinesA20190121,2019-01-21, Thunder,Alex Abrines, activated from IL
AbrinesA20190121,2019-01-21, Thunder,Alex Abrines, activated from IL
McRaeJ20190121,2019-01-21, Wizards,Jordan McRae, activated from IL
WilliamsL20190122,2019-01-22, Clippers,Louis Williams, returned to lineup
SmithD20190122,2019-01-22, Mavericks,Dennis Smith Jr., activated from IL
MejriS20190122,2019-01-22, Mavericks,Salah Mejri, activated from IL
AnthonyC20190122,2019-01-22, Rockets,Carmelo Anthony, player returned to team
WilliamsR20190123,2019-01-23, Celtics,Robert Williams III, activated from IL
CasspiO20190123,2019-01-23, Grizzlies,Omri Casspi, returned to lineup
BurkeT20190123,2019-01-23, Knicks,Trey Burke, activated from IL
GordonA20190123,2019-01-23, Magic,Aaron Gordon, activated from IL
HernangomezJ20190123,2019-01-23, Nuggets,Juancho Hernangomez, returned to lineup
LeonardK20190123,2019-01-23, Raptors,Kawhi Leonard, activated from IL
RondoR20190124,2019-01-24, Lakers,Rajon Rondo, activated from IL
TeagueJ20190124,2019-01-24, Timberwolves,Jeff Teague, activated from IL
SmithJ20190125,2019-01-25, Bucks,Jason Smith, activated from IL
ParkerJ20190125,2019-01-25, Bulls,Jabari Parker, returned to lineup
NanceL20190125,2019-01-25, Cavaliers,Larry Nance Jr., activated from IL
NoahJ20190125,2019-01-25, Grizzlies,Joakim Noah, activated from IL
FoxD20190125,2019-01-25, Kings,De'Aaron Fox, returned to lineup
BjelicaN20190125,2019-01-25, Kings,Nemanja Bjelica, returned to lineup
FrazierM20190125,2019-01-25, Magic,Melvin Frazier Jr., activated from IL
VanderbiltJ20190125,2019-01-25, Nuggets,Jarred Vanderbilt, activated from IL
DrummondA20190125,2019-01-25, Pistons,Andre Drummond, activated from IL
EllensonH20190125,2019-01-25, Pistons,Henry Ellenson, activated from IL
AnunobyO20190125,2019-01-25, Raptors,Ogugua Anunoby, activated from IL
MiltonS20190126,2019-01-26, 76ers,Shake Milton, activated from IL
StauskasN20190126,2019-01-26, Blazers,Nik Stauskas, returned to lineup
HorfordA20190126,2019-01-26, Celtics,Al Horford, activated from IL
IrvingK20190126,2019-01-26, Celtics,Kyrie Irving, activated from IL
HuerterK20190126,2019-01-26, Hawks,Kevin Huerter, activated from IL
SumnerE20190126,2019-01-26, Pacers,Edmond Sumner, activated from IL
WaitersD20190127,2019-01-27, Heat,Dion Waiters, returned to lineup
KnightB20190127,2019-01-27, Rockets,Brandon Knight, returned to lineup
PaulC20190127,2019-01-27, Rockets,Chris Paul, activated from IL
BertansD20190127,2019-01-27, Spurs,Davis Bertans, activated from IL
HolmesR20190127,2019-01-27, Suns,Richaun Holmes, activated from IL
WilliamsR20190128,2019-01-28, Celtics,Robert Williams III, activated from IL
AndersonK20190128,2019-01-28, Grizzlies,Kyle Anderson, activated from IL
AllenK20190128,2019-01-28, Knicks,Kadeem Allen, activated from IL
ButlerJ20190129,2019-01-29, 76ers,Jimmy Butler, activated from IL
EmbiidJ20190129,2019-01-29, 76ers,Joel Embiid, activated from IL
ChandlerW20190129,2019-01-29, 76ers,Wilson Chandler, activated from IL
GrahamT20190129,2019-01-29, Nets,Treveon Graham, returned to lineup
MahinmiI20190129,2019-01-29, Wizards,Ian Mahinmi, returned to lineup
DekkerS20190129,2019-01-29, Wizards,Sam Dekker, returned to lineup
LillardD20190130,2019-01-30, Blazers,Damian Lillard, activated from IL
GreenJ20190130,2019-01-30, Grizzlies,JaMychal Green, returned to lineup
BazemoreK20190130,2019-01-30, Hawks,Kent Bazemore, activated from IL
JohnsonT20190130,2019-01-30, Heat,Tyler Johnson, returned to lineup
TeagueJ20190130,2019-01-30, Timberwolves,Jeff Teague, activated from IL
BoldenJ20190131,2019-01-31, 76ers,Jonah Bolden, activated from IL
BrogdonM20190131,2019-01-31, Bucks,Malcolm Brogdon, activated from IL
BrownS20190131,2019-01-31, Bucks,Sterling Brown, returned to lineup
KuzmaK20190131,2019-01-31, Lakers,Kyle Kuzma, returned to lineup
JamesL20190131,2019-01-31, Lakers,LeBron James, activated from IL
BriscoeI20190131,2019-01-31, Magic,Isaiah Briscoe, activated from IL
FrazierM20190131,2019-01-31, Magic,Melvin Frazier Jr., activated from IL
MusaD20190131,2019-01-31, Nets,Dzanan Musa, activated from IL
BullockR20190131,2019-01-31, Pistons,Reggie Bullock, activated from IL
BoucherC20190131,2019-01-31, Raptors,Chris Boucher, activated from IL
GreenD20190131,2019-01-31, Warriors,Draymond Green, activated from IL
JerebkoJ20190131,2019-01-31, Warriors,Jonas Jerebko, activated from IL
IrvingK20190201,2019-02-01, Celtics,Kyrie Irving, activated from IL
WatanabeY20190201,2019-02-01, Grizzlies,Yuta Watanabe, activated from IL
DorseyT20190201,2019-02-01, Hawks,Tyler Dorsey, activated from IL
WadeD20190201,2019-02-01, Heat,Dwyane Wade, returned to lineup
Tony(20190201,2019-02-01, Hornets,(William) Tony Parker, activated from IL
HicksI20190201,2019-02-01, Knicks,Isaiah Hicks, activated from IL
KornetL20190201,2019-02-01, Knicks,Luke Kornet, activated from IL
HartensteinI20190201,2019-02-01, Rockets,Isaiah Hartenstein, activated from IL
AdamsS20190201,2019-02-01, Thunder,Steven Adams, returned to lineup
FergusonT20190201,2019-02-01, Thunder,Terrance Ferguson, activated from IL
JohnsonA20190202,2019-02-02, 76ers,Amir Johnson, activated from IL
MiltonS20190202,2019-02-02, 76ers,Shake Milton, activated from IL
LaVineZ20190202,2019-02-02, Bulls,Zach LaVine, returned to lineup
NwabaD20190202,2019-02-02, Cavaliers,David Nwaba, activated from IL
DoncicL20190202,2019-02-02, Mavericks,Luka Doncic, returned to lineup
EvansT20190202,2019-02-02, Pacers,Tyreke Evans, activated from IL
SmithI20190202,2019-02-02, Pistons,Ishmael Smith, activated from IL
AytonD20190202,2019-02-02, Suns,Deandre Ayton, activated from IL
RoseD20190202,2019-02-02, Timberwolves,Derrick Rose, returned to lineup
ThompsonK20190202,2019-02-02, Warriors,Klay Thompson, returned to lineup
JacksonJ20190203,2019-02-03, Grizzlies,Jaren Jackson Jr., returned to lineup
ConleyM20190203,2019-02-03, Grizzlies,Mike Conley Jr., activated from IL
JordanD20190203,2019-02-03, Knicks,DeAndre Jordan, activated from IL
MatthewsW20190203,2019-02-03, Knicks,Wesley Matthews, activated from IL
BledsoeE20190204,2019-02-04, Bucks,Eric Bledsoe, returned to lineup
ParkerJ20190204,2019-02-04, Bulls,Jabari Parker, activated from IL
CunninghamD20190204,2019-02-04, Spurs,Dante Cunningham, returned to lineup
WalkerL20190204,2019-02-04, Spurs,Lonnie Walker IV, activated from IL
TrentG20190205,2019-02-05, Blazers,Gary Trent Jr., activated from IL
ZellerC20190205,2019-02-05, Hornets,Cody Zeller, activated from IL
RobinsonM20190205,2019-02-05, Knicks,Mitchell Robinson, activated from IL
LowryK20190205,2019-02-05, Raptors,Kyle Lowry, activated from IL
NaderA20190205,2019-02-05, Thunder,Abdel Nader, returned to lineup
GasolM20190206,2019-02-06, Grizzlies,Marc Gasol, returned to lineup
NetoR20190206,2019-02-06, Jazz,Raulzinho Neto, activated from IL
LeeC20190206,2019-02-06, Knicks,Courtney Lee, activated from IL
HardawayT20190206,2019-02-06, Mavericks,Tim Hardaway Jr., activated from IL
BurkeT20190206,2019-02-06, Mavericks,Trey Burke, activated from IL
CrabbeA20190206,2019-02-06, Nets,Allen Crabbe, activated from IL
HarrisJ20190206,2019-02-06, Nets,Joe Harris, returned to lineup
MurrayJ20190206,2019-02-06, Nuggets,Jamal Murray, activated from IL
DavisA20190206,2019-02-06, Pelicans,Anthony Davis, activated from IL
RandleJ20190206,2019-02-06, Pelicans,Julius Randle, activated from IL
GordonE20190206,2019-02-06, Rockets,Eric Gordon, activated from IL
RichardsonM20190206,2019-02-06, Raptors,Malachi Richardson, activated from IL
HoodR20190207,2019-02-07, Blazers,Rodney Hood, activated from IL
IrvingK20190207,2019-02-07, Celtics,Kyrie Irving, activated from IL
MorrisM20190207,2019-02-07, Celtics,Marcus Morris, returned to lineup
WilliamsR20190207,2019-02-07, Celtics,Robert Williams III, activated from IL
GallinariD20190207,2019-02-07, Clippers,Danilo Gallinari, activated from IL
AdamsJ20190207,2019-02-07, Hawks,Jaylen Adams, activated from IL
HartJ20190207,2019-02-07, Lakers,Josh Hart, returned to lineup
BirdJ20190207,2019-02-07, Celtics,Jabari Bird, activated from IL
CasspiO20190207,2019-02-07, Grizzlies,Omri Casspi, activated from IL
RedickJ20190208,2019-02-08, 76ers,J.J. Redick, activated from IL
LoveK20190208,2019-02-08, Cavaliers,Kevin Love, activated from IL
HicksI20190208,2019-02-08, Knicks,Isaiah Hicks, activated from IL
LeVertC20190208,2019-02-08, Nets,Caris LeVert, activated from IL
