key,date,team,name,notes
LivingstonS20190412,2019-04-12, Warriors,Shaun Livingston, activated from IL
CurryS20190412,2019-04-12, Warriors,Stephen Curry, activated from IL
EmbiidJ20190413,2019-04-13, 76ers,Joel Embiid, activated from IL
BoldenJ20190413,2019-04-13, 76ers,Jonah Bolden, returned to lineup
BaynesA20190413,2019-04-13, Celtics,Aron Baynes, activated from IL
HaywardG20190413,2019-04-13, Celtics,Gordon Hayward, activated from IL
TatumJ20190413,2019-04-13, Celtics,Jayson Tatum, returned to lineup
IrvingK20190413,2019-04-13, Celtics,Kyrie Irving, activated from IL
IsaacJ20190413,2019-04-13, Magic,Jonathan Isaac, activated from IL
TurnerM20190413,2019-04-13, Pacers,Myles Turner, activated from IL
MatthewsW20190413,2019-04-13, Pacers,Wesley Matthews, activated from IL
MiroticN20190414,2019-04-14, Bucks,Nikola Mirotic, activated from IL
HorfordA20190414,2019-04-14, Celtics,Al Horford, activated from IL
MorrisM20190414,2019-04-14, Celtics,Marcus Morris, activated from IL
MitchellD20190414,2019-04-14, Jazz,Donovan Mitchell, activated from IL
KorverK20190414,2019-04-14, Jazz,Kyle Korver, activated from IL
NetoR20190414,2019-04-14, Jazz,Raulzinho Neto, activated from IL
RubioR20190414,2019-04-14, Jazz,Ricky Rubio, activated from IL
GobertR20190414,2019-04-14, Jazz,Rudy Gobert, activated from IL
BogdanovicB20190414,2019-04-14, Pacers,Bojan Bogdanovic, returned to lineup
YoungT20190414,2019-04-14, Pacers,Thaddeus Young, returned to lineup
GeorgeP20190414,2019-04-14, Thunder,Paul George, activated from IL
BrogdonM20190414,2019-04-14, Bucks,Malcolm Brogdon, activated from IL
EnnisJ20190415,2019-04-15, 76ers,James Ennis, activated from IL
DudleyJ20190418,2019-04-18, Nets,Jared Dudley, activated from IL
McCawP20190419,2019-04-19, Raptors,Patrick McCaw, activated from IL
EmbiidJ20190420,2019-04-20, 76ers,Joel Embiid, returned to lineup
SnellT20190420,2019-04-20, Bucks,Tony Snell, returned to lineup
GriffinB20190420,2019-04-20, Pistons,Blake Griffin, activated from IL
SmithZ20190427,2019-04-27, 76ers,Zhaire Smith, activated from IL
YabuseleG20190428,2019-04-28, Celtics,Guerschon Yabusele, activated from IL
RiversA20190430,2019-04-30, Rockets,Austin Rivers, activated from IL
Mike(20190502,2019-05-02, 76ers,(James) Mike Scott, activated from IL
LinJ20190505,2019-05-05, Raptors,Jeremy Lin, activated from IL
SmartM20190506,2019-05-06, Celtics,Marcus Smart, activated from IL
BrogdonM20190508,2019-05-08, Bucks,Malcolm Brogdon, returned to lineup
HouseD20190508,2019-05-08, Rockets,Danuel House, activated from IL
HouseD20190510,2019-05-10, Rockets,Danuel House, returned to lineup
FariedK20190510,2019-05-10, Rockets,Kenneth Faried, returned to lineup
JonesD20190514,2019-05-14, Warriors,Damian Jones, activated from IL
BoucherC20190515,2019-05-15, Raptors,Chris Boucher, activated from IL
WilsonD20190517,2019-05-17, Bucks,D.J. Wilson, returned to lineup
WilsonD20190521,2019-05-21, Bucks,D.J. Wilson, returned to lineup
McCawP20190525,2019-05-25, Raptors,Patrick McCaw, activated from IL
IguodalaA20190530,2019-05-30, Warriors,Andre Iguodala, activated from IL
CousinsD20190530,2019-05-30, Warriors,DeMarcus Cousins, activated from IL
AnunobyO20190602,2019-06-02, Raptors,Ogugua Anunoby, activated from IL
LooneyK20190607,2019-06-07, Warriors,Kevon Looney, activated from IL
ThompsonK20190607,2019-06-07, Warriors,Klay Thompson, returned to lineup
DurantK20190610,2019-06-10, Warriors,Kevin Durant, activated from IL
