key,date,team,name,notes
LeuerJ20190208rel,2019-02-08, Pistons,Jon Leuer, placed on IL
BaylessJ20190208rel,2019-02-08, Timberwolves,Jerryd Bayless, right big toe injury (DTD)
AntetokounmpoK20190208rel,2019-02-08, Mavericks,Kostas Antetokounmpo, illness (DTD)
AntetokounmpoG20190209rel,2019-02-09, Bucks,Giannis Antetokounmpo, placed on IL with sore right knee
LoveK20190209rel,2019-02-09, Cavaliers,Kevin Love, placed on IL
AndersonK20190209rel,2019-02-09, Grizzlies,Kyle Anderson, placed on IL with sore right shoulder (out for season)
WatanabeY20190209rel,2019-02-09, Grizzlies,Yuta Watanabe, ankle injury (DTD)
HartensteinI20190209rel,2019-02-09, Rockets,Isaiah Hartenstein, placed on IL
GayR20190209rel,2019-02-09, Spurs,Rudy Gay, sprained left ankle (DTD)
ValanciunasJ20190209rel,2019-02-09, Grizzlies,Jonas Valanciunas, visa issues (DTD)
AdamsJ20190209rel,2019-02-09, Hawks,Jaylen Adams, placed on IL with sprained right ankle
TrentG20190210rel,2019-02-10, Blazers,Gary Trent Jr., placed on IL
GrantJ20190210rel,2019-02-10, Thunder,Jerami Grant, sprained right ankle (DTD)
IguodalaA20190210rel,2019-02-10, Warriors,Andre Iguodala, placed on IL with left hamstring injury
EvansJ20190210rel,2019-02-10, Warriors,Jacob Evans, pelvic injury (DTD)
MejriS20190210rel,2019-02-10, Mavericks,Salah Mejri, placed on IL
ZizicA20190211rel,2019-02-11, Cavaliers,Ante Zizic, placed on IL with sore lower back
GrahamD20190211rel,2019-02-11, Hornets,Devonte' Graham, placed on IL with illness
HartJ20190211rel,2019-02-11, Lakers,Josh Hart, right knee tendinitis (DTD)
CarrollD20190211rel,2019-02-11, Nets,DeMarre Carroll, sore left knee (DTD)
LydonT20190211rel,2019-02-11, Nuggets,Tyler Lydon, placed on IL with concussion
VanVleetF20190211rel,2019-02-11, Raptors,Fred VanVleet, placed on IL with left thumb injury
SchroderD20190211rel,2019-02-11, Thunder,Dennis Schroder, personal reasons (DTD)
GrantJ20190211rel,2019-02-11, Thunder,Jerami Grant, placed on IL with sprained right ankle
WigginsA20190211rel,2019-02-11, Timberwolves,Andrew Wiggins, placed on IL with illness
SatoranskyT20190211rel,2019-02-11, Wizards,Tomas Satoransky, placed on IL for personal reasons
IrvingK20190212rel,2019-02-12, Celtics,Kyrie Irving, placed on IL with strained right knee
WilliamsR20190212rel,2019-02-12, Celtics,Robert Williams III, sore back (DTD)
ConleyM20190212rel,2019-02-12, Grizzlies,Mike Conley Jr., illness (DTD)
WatanabeY20190212rel,2019-02-12, Grizzlies,Yuta Watanabe, placed on IL with ankle injury
ChandlerT20190212rel,2019-02-12, Lakers,Tyson Chandler, right big toe injury (DTD)
RiversA20190212rel,2019-02-12, Rockets,Austin Rivers, sore right elbow (DTD)
KorkmazF20190213rel,2019-02-13, 76ers,Furkan Korkmaz, placed on IL with sore right knee
TrentG20190213rel,2019-02-13, Blazers,Gary Trent Jr., placed on IL
DunnK20190213rel,2019-02-13, Bulls,Kris Dunn, placed on IL with bruised tailbone
RozierT20190213rel,2019-02-13, Celtics,Terry Rozier, placed on IL with illness
KurucsR20190213rel,2019-02-13, Nets,Rodions Kurucs, sprained left elbow (DTD)
GrahamT20190213rel,2019-02-13, Nets,Treveon Graham, placed on IL for personal reasons
MykhailiukS20190213rel,2019-02-13, Pistons,Sviatoslav Mykhailiuk, placed on IL
LeonardK20190213rel,2019-02-13, Raptors,Kawhi Leonard, sore left knee (DTD)
McCawP20190213rel,2019-02-13, Raptors,Patrick McCaw, placed on IL with sore right shoulder
IguodalaA20190213rel,2019-02-13, Warriors,Andre Iguodala, placed on IL
CousinsD20190213rel,2019-02-13, Warriors,DeMarcus Cousins, placed on IL
LivingstonS20190213rel,2019-02-13, Warriors,Shaun Livingston, placed on IL
WilliamsR20190213rel,2019-02-13, Celtics,Robert Williams III, placed on IL with illness
BiyomboB20190214rel,2019-02-14, Hornets,Bismack Biyombo, placed on IL
HezonjaM20190214rel,2019-02-14, Knicks,Mario Hezonja, placed on IL with bruised left leg
EmbiidJ20190220rel,2019-02-20, 76ers,Joel Embiid, sore left knee (DTD)
ShumpertI20190220rel,2019-02-20, Rockets,Iman Shumpert, sore right knee (DTD)
EmbiidJ20190221rel,2019-02-21, 76ers,Joel Embiid, placed on IL with sore left knee
HaywardG20190221rel,2019-02-21, Celtics,Gordon Hayward, placed on IL with sprained right ankle
ValanciunasJ20190221rel,2019-02-21, Grizzlies,Jonas Valanciunas, personal reasons (DTD)
MuscalaM20190221rel,2019-02-21, Lakers,Mike Muscala, placed on IL with sprained right ankle
LylesT20190221rel,2019-02-21, Nuggets,Trey Lyles, strained left hamstring (DTD)
ShumpertI20190221rel,2019-02-21, Rockets,Iman Shumpert, placed on IL with sore right knee
HartensteinI20190221rel,2019-02-21, Rockets,Isaiah Hartenstein, placed on IL
DiengG20190221rel,2019-02-21, Timberwolves,Gorgui Dieng, personal reasons (DTD)
LivingstonS20190221rel,2019-02-21, Warriors,Shaun Livingston, personal reasons (DTD)
TurnerE20190222rel,2019-02-22, Blazers,Evan Turner, sore left knee (DTD)
JacksonJ20190222rel,2019-02-22, Grizzlies,Jaren Jackson Jr., placed on IL with right quadricep injury (out for season)
HuerterK20190222rel,2019-02-22, Hawks,Kevin Huerter, placed on IL with sprained left ankle
HicksI20190222rel,2019-02-22, Knicks,Isaiah Hicks, placed on IL
AllenK20190222rel,2019-02-22, Knicks,Kadeem Allen, placed on IL
FrazierM20190222rel,2019-02-22, Magic,Melvin Frazier Jr., placed on IL
DoncicL20190222rel,2019-02-22, Mavericks,Luka Doncic, placed on IL with sore right ankle
LylesT20190222rel,2019-02-22, Nuggets,Trey Lyles, placed on IL with strained left hamstring
TurnerM20190222rel,2019-02-22, Pacers,Myles Turner, placed on IL with bruised left hip
MillerD20190222rel,2019-02-22, Pelicans,Darius Miller, placed on IL with sprained right ankle
SchroderD20190222rel,2019-02-22, Thunder,Dennis Schroder, placed on IL for personal reasons
DiengG20190222rel,2019-02-22, Timberwolves,Gorgui Dieng, placed on IL for personal reasons
TownsK20190222rel,2019-02-22, Timberwolves,Karl-Anthony Towns, placed on IL with concussion
McRaeJ20190222rel,2019-02-22, Wizards,Jordan McRae, placed on IL
TurnerE20190223rel,2019-02-23, Blazers,Evan Turner, placed on IL with sore left knee
JohnsonJ20190223rel,2019-02-23, Heat,James Johnson, placed on IL with sprained left shoulder
WinslowJ20190223rel,2019-02-23, Heat,Justise Winslow, placed on IL with sprained left knee
KleberM20190223rel,2019-02-23, Mavericks,Maximilian Kleber, placed on IL with illness
DavisA20190223rel,2019-02-23, Pelicans,Anthony Davis, placed on IL
HardenJ20190223rel,2019-02-23, Rockets,James Harden, placed on IL with cervical strain
HillG20190224rel,2019-02-24, Bucks,George Hill, strained left groin (DTD)
PrinceT20190224rel,2019-02-24, Hawks,Taurean Prince, personal reasons (DTD)
JordanD20190224rel,2019-02-24, Knicks,DeAndre Jordan, placed on IL with sprained left ankle
BriscoeI20190224rel,2019-02-24, Magic,Isaiah Briscoe, placed on IL with concussion
WhiteD20190224rel,2019-02-24, Spurs,Derrick White, right heel injury (DTD)
KorkmazF20190225rel,2019-02-25, 76ers,Furkan Korkmaz, placed on IL with sore right knee
TrentG20190225rel,2019-02-25, Blazers,Gary Trent Jr., placed on IL
HillG20190225rel,2019-02-25, Bucks,George Hill, placed on IL with strained left groin
AntetokounmpoG20190225rel,2019-02-25, Bucks,Giannis Antetokounmpo, placed on IL with sore right knee
BrownS20190225rel,2019-02-25, Bucks,Sterling Brown, placed on IL with right wrist injury
DunnK20190225rel,2019-02-25, Bulls,Kris Dunn, placed on IL with migraine headache
PorterO20190225rel,2019-02-25, Bulls,Otto Porter Jr., placed on IL with lower leg injury
MilesC20190225rel,2019-02-25, Grizzlies,C.J. Miles, right hip injury (DTD)
JonesD20190225rel,2019-02-25, Heat,Derrick Jones Jr., illness (DTD)
McGruderR20190225rel,2019-02-25, Heat,Rodney McGruder, bruised right knee (DTD)
TeagueJ20190225rel,2019-02-25, Timberwolves,Jeff Teague, sore left knee (DTD)
EvansJ20190225rel,2019-02-25, Warriors,Jacob Evans, placed on IL
EvansJ20190225rel,2019-02-25, Warriors,Jacob Evans, placed on IL
BellJ20190225rel,2019-02-25, Warriors,Jordan Bell, placed on IL with flu
JohnsonA20190225rel,2019-02-25, Pacers,Alize Johnson, bruised left foot (DTD)
MarjanovicB20190226rel,2019-02-26, 76ers,Boban Marjanovic, right knee injury (DTD)
WanamakerB20190226rel,2019-02-26, Celtics,Brad Wanamaker, illness (DTD)
SabonisD20190226rel,2019-02-26, Pacers,Domantas Sabonis, sprained left ankle (DTD)
RozierT20190227rel,2019-02-27, Celtics,Terry Rozier, placed on IL with sore left knee
RabbI20190227rel,2019-02-27, Grizzlies,Ivan Rabb, right heel injury (DTD)
PoythressA20190227rel,2019-02-27, Hawks,Alex Poythress, placed on IL
PrinceT20190227rel,2019-02-27, Hawks,Taurean Prince, placed on IL for personal reasons
WhitesideH20190227rel,2019-02-27, Heat,Hassan Whiteside, strained left hip (DTD)
BurkeT20190227rel,2019-02-27, Mavericks,Trey Burke, placed on IL with illness
SabonisD20190227rel,2019-02-27, Pacers,Domantas Sabonis, placed on IL with sprained left ankle
SumnerE20190227rel,2019-02-27, Pacers,Edmond Sumner, placed on IL
EvansT20190227rel,2019-02-27, Pacers,Tyreke Evans, food poisoning (DTD)
TeagueJ20190227rel,2019-02-27, Timberwolves,Jeff Teague, placed on IL with sore left knee
CousinsD20190227rel,2019-02-27, Warriors,DeMarcus Cousins, placed on IL
MarjanovicB20190228rel,2019-02-28, 76ers,Boban Marjanovic, placed on IL with right knee injury
KanterE20190228rel,2019-02-28, Blazers,Enes Kanter, personal reasons (DTD)
NetoR20190228rel,2019-02-28, Jazz,Raulzinho Neto, placed on IL with left hamstring injury
RubioR20190228rel,2019-02-28, Jazz,Ricky Rubio, placed on IL with left hamstring injury
BagleyM20190228rel,2019-02-28, Kings,Marvin Bagley III, sprained left knee (DTD)
StephensonL20190228rel,2019-02-28, Lakers,Lance Stephenson, sprained toe (DTD)
GordonE20190228rel,2019-02-28, Rockets,Eric Gordon, sore right knee (DTD)
ShumpertI20190228rel,2019-02-28, Rockets,Iman Shumpert, right calf injury (DTD)
FariedK20190228rel,2019-02-28, Rockets,Kenneth Faried, bruised left hip / strained adductor in left hip (DTD)
GeorgeP20190228rel,2019-02-28, Thunder,Paul George, sore right shoulder (DTD)
DengL20190228rel,2019-02-28, Timberwolves,Luol Deng, placed on IL with left Achilles injury (out for season)
IguodalaA20190228rel,2019-02-28, Warriors,Andre Iguodala, placed on IL with illness
DurantK20190228rel,2019-02-28, Warriors,Kevin Durant, placed on IL
KanterE20190301rel,2019-03-01, Blazers,Enes Kanter, placed on IL for personal reasons
ZizicA20190301rel,2019-03-01, Cavaliers,Ante Zizic, concussion (DTD)
CollinsJ20190301rel,2019-03-01, Hawks,John Collins (Martin), placed on IL with flu
BagleyM20190301rel,2019-03-01, Kings,Marvin Bagley III, placed on IL with sprained left knee
StephensonL20190301rel,2019-03-01, Lakers,Lance Stephenson, placed on IL with sprained toe
JohnsonA20190302rel,2019-03-02, 76ers,Amir Johnson, back injury (DTD)
BledsoeE20190302rel,2019-03-02, Bucks,Eric Bledsoe, sore back (DTD)
BrogdonM20190302rel,2019-03-02, Bucks,Malcolm Brogdon, placed on IL with right foot injury
PrinceT20190302rel,2019-03-02, Hawks,Taurean Prince, personal reasons (DTD)
DragicG20190302rel,2019-03-02, Heat,Goran Dragic, strained left calf (DTD)
WhitesideH20190302rel,2019-03-02, Heat,Hassan Whiteside, placed on IL with strained left hip
DavisA20190302rel,2019-03-02, Pelicans,Anthony Davis, placed on IL
LeuerJ20190302rel,2019-03-02, Pistons,Jon Leuer, placed on IL
LooneyK20190302rel,2019-03-02, Warriors,Kevon Looney, pelvic injury (DTD)
ThompsonK20190302rel,2019-03-02, Warriors,Klay Thompson, sore right knee (DTD)
BertansD20190302rel,2019-03-02, Pelicans,Dairis Bertans, placed on IL for personal reasons
TrentG20190303rel,2019-03-03, Blazers,Gary Trent Jr., placed on IL
ZizicA20190303rel,2019-03-03, Cavaliers,Ante Zizic, placed on IL with concussion
YabuseleG20190303rel,2019-03-03, Celtics,Guerschon Yabusele, placed on IL
ConleyM20190303rel,2019-03-03, Grizzlies,Mike Conley Jr., general soreness (DTD)
SpellmanO20190303rel,2019-03-03, Hawks,Omari Spellman, placed on IL with sprained left ankle (out for season)
PrinceT20190303rel,2019-03-03, Hawks,Taurean Prince, placed on IL for personal reasons
MykhailiukS20190303rel,2019-03-03, Pistons,Sviatoslav Mykhailiuk, placed on IL
DragicG20190304rel,2019-03-04, Heat,Goran Dragic, placed on IL with strained left calf
IngramB20190304rel,2019-03-04, Lakers,Brandon Ingram, sore right shoulder (out for season)
ChandlerT20190304rel,2019-03-04, Lakers,Tyson Chandler, placed on IL with stiff neck
GrahamT20190304rel,2019-03-04, Nets,Treveon Graham, placed on IL with sore back
OkaforJ20190304rel,2019-03-04, Pelicans,Jahlil Okafor, placed on IL with sprained left ankle
AntetokounmpoK20190304rel,2019-03-04, Mavericks,Kostas Antetokounmpo, hip flexor injury (DTD)
BoldenJ20190305rel,2019-03-05, 76ers,Jonah Bolden, illness (DTD)
KuzmaK20190305rel,2019-03-05, Lakers,Kyle Kuzma, sprained right ankle (DTD)
RossT20190305rel,2019-03-05, Magic,Terrence Ross, placed on IL with left Achilles injury
DialloH20190305rel,2019-03-05, Thunder,Hamidou Diallo, placed on IL
LooneyK20190305rel,2019-03-05, Warriors,Kevon Looney, placed on IL with pelvic injury
ThompsonK20190305rel,2019-03-05, Warriors,Klay Thompson, placed on IL with sore right knee
LivingstonS20190305rel,2019-03-05, Warriors,Shaun Livingston, neck spasms (DTD)
SumnerE20190305rel,2019-03-05, Pacers,Edmond Sumner, bruised left knee (DTD)
TurnerE20190306rel,2019-03-06, Blazers,Evan Turner, personal reasons (DTD)
IrvingK20190306rel,2019-03-06, Celtics,Kyrie Irving, placed on IL with left thigh injury
DedmonD20190306rel,2019-03-06, Hawks,Dewayne Dedmon, placed on IL with bruised right knee
UdohE20190306rel,2019-03-06, Jazz,Ekpe Udoh, back spasms (DTD)
KuzmaK20190306rel,2019-03-06, Lakers,Kyle Kuzma, placed on IL with sprained right ankle
KleberM20190306rel,2019-03-06, Mavericks,Maximilian Kleber, placed on IL with left knee injury
LeuerJ20190306rel,2019-03-06, Pistons,Jon Leuer, right knee injury (DTD)
PachuliaZ20190306rel,2019-03-06, Pistons,Zaur Pachulia, placed on IL with right Achilles injury
PoeltlJ20190306rel,2019-03-06, Spurs,Jakob Poeltl, placed on IL with left hamstring injury
TurnerE20190307rel,2019-03-07, Blazers,Evan Turner, placed on IL for personal reasons
DellavedovaM20190307rel,2019-03-07, Cavaliers,Matthew Dellavedova, concussion (out for season)
MooreE20190307rel,2019-03-07, Pelicans,E'Twaun Moore, bruised left quadricep (out for season)
HolidayJ20190307rel,2019-03-07, Pelicans,Jrue Holiday, strained lower abdominal (out for season)
DellavedovaM20190308rel,2019-03-08, Cavaliers,Matthew Dellavedova, placed on IL with concussion (out for season)
BiyomboB20190308rel,2019-03-08, Hornets,Bismack Biyombo, placed on IL with sprained left knee
RubioR20190308rel,2019-03-08, Jazz,Ricky Rubio, placed on IL with hip injury
BriscoeI20190308rel,2019-03-08, Magic,Isaiah Briscoe, right knee injury (DTD)
NapierS20190308rel,2019-03-08, Nets,Shabazz Napier, personal reasons (DTD)
DavisA20190308rel,2019-03-08, Pelicans,Anthony Davis, lower back spasms (DTD)
HolidayJ20190308rel,2019-03-08, Pelicans,Jrue Holiday, placed on IL with strained lower abdominal (out for season)
BogutA20190308rel,2019-03-08, Warriors,Andrew Bogut, visa issues (DTD)
PachuliaZ20190308rel,2019-03-08, Pistons,Zaur Pachulia, right Achilles injury (DTD)
TurnerE20190309rel,2019-03-09, Blazers,Evan Turner, placed on IL with left knee injury
TrentG20190309rel,2019-03-09, Blazers,Gary Trent Jr., placed on IL
PoythressA20190309rel,2019-03-09, Hawks,Alex Poythress, placed on IL with sprained right ankle (out for season)
Tony(20190309rel,2019-03-09, Hornets,(William) Tony Parker, placed on IL
Kidd-GilchristM20190309rel,2019-03-09, Hornets,Michael Kidd-Gilchrist, placed on IL with strained left knee
VonlehN20190309rel,2019-03-09, Knicks,Noah Vonleh, bruised right hip (DTD)
IngramB20190309rel,2019-03-09, Lakers,Brandon Ingram, placed on IL with blood clot in right arm (out for season)
StephensonL20190309rel,2019-03-09, Lakers,Lance Stephenson, sprained toe (DTD)
WigginsA20190309rel,2019-03-09, Timberwolves,Andrew Wiggins, bruised left quadricep (DTD)
LaVineZ20190310rel,2019-03-10, Bulls,Zach LaVine, right knee injury (DTD)
NanceL20190310rel,2019-03-10, Cavaliers,Larry Nance Jr., rib injury (DTD)
BriscoeI20190310rel,2019-03-10, Magic,Isaiah Briscoe, placed on IL with right knee injury
AntetokounmpoK20190310rel,2019-03-10, Mavericks,Kostas Antetokounmpo, placed on IL
NapierS20190310rel,2019-03-10, Nets,Shabazz Napier, placed on IL for personal reasons
EvansT20190310rel,2019-03-10, Pacers,Tyreke Evans, placed on IL with illness
MooreE20190310rel,2019-03-10, Pelicans,E'Twaun Moore, placed on IL with bruised left quadricep (out for season)
BrownB20190310rel,2019-03-10, Pistons,Bruce Brown, placed on IL with sprained right ankle
GayR20190310rel,2019-03-10, Spurs,Rudy Gay, placed on IL with illness
WigginsA20190310rel,2019-03-10, Timberwolves,Andrew Wiggins, placed on IL with bruised left quadricep
TownsK20190310rel,2019-03-10, Timberwolves,Karl-Anthony Towns, placed on IL with right knee inflammation
TatumJ20190311rel,2019-03-11, Celtics,Jayson Tatum, placed on IL with sore right shoulder
ZellerC20190311rel,2019-03-11, Hornets,Cody Zeller, sore left knee (out for season)
WilliamsM20190311rel,2019-03-11, Hornets,Marvin Williams, placed on IL with illness
BatumN20190311rel,2019-03-11, Hornets,Nicolas Batum, right eye injury (DTD)
BriscoeI20190311rel,2019-03-11, Magic,Isaiah Briscoe, surgery on right knee (out indefinitely)
HartensteinI20190311rel,2019-03-11, Rockets,Isaiah Hartenstein, right Achilles injury (DTD)
JonesT20190311rel,2019-03-11, Rockets,Terrence Jones, placed on IL with illness
HoodR20190312rel,2019-03-12, Blazers,Rodney Hood, placed on IL with right hip injury
LaVineZ20190312rel,2019-03-12, Bulls,Zach LaVine, placed on IL with right knee injury
NanceL20190312rel,2019-03-12, Cavaliers,Larry Nance Jr., placed on IL with rib injury
GallinariD20190312rel,2019-03-12, Clippers,Danilo Gallinari, sore left ankle (DTD)
StephensonL20190312rel,2019-03-12, Lakers,Lance Stephenson, placed on IL with sprained toe
CarrollD20190312rel,2019-03-12, Nets,DeMarre Carroll, hyperextended left knee (DTD)
EvansT20190312rel,2019-03-12, Pacers,Tyreke Evans, placed on IL for personal reasons
RoseD20190312rel,2019-03-12, Timberwolves,Derrick Rose, sore right elbow (out for season)
TeagueJ20190312rel,2019-03-12, Timberwolves,Jeff Teague, placed on IL with left foot injury (out for season)
DurantK20190312rel,2019-03-12, Warriors,Kevin Durant, sprained right ankle (DTD)
CarrollD20190313rel,2019-03-13, Nets,DeMarre Carroll, placed on IL with hyperextended left knee
NapierS20190313rel,2019-03-13, Nets,Shabazz Napier, right hamstring injury (DTD)
MorrisM20190313rel,2019-03-13, Thunder,Markieff Morris, sore neck (DTD)
DurantK20190313rel,2019-03-13, Warriors,Kevin Durant, placed on IL with sprained right ankle
DekkerS20190313rel,2019-03-13, Wizards,Sam Dekker, sore lower back (DTD)
TheisD20190314rel,2019-03-14, Celtics,Daniel Theis, placed on IL with illness
RozierT20190314rel,2019-03-14, Celtics,Terry Rozier, placed on IL with illness
SefoloshaT20190314rel,2019-03-14, Jazz,Thabo Sefolosha, left hamstring injury (DTD)
CraigT20190314rel,2019-03-14, Nuggets,Torrey Craig, placed on IL with sprained left shoulder
LowryK20190314rel,2019-03-14, Raptors,Kyle Lowry, placed on IL with sprained left ankle
RoseD20190314rel,2019-03-14, Timberwolves,Derrick Rose, placed on IL with sore right elbow
SmithZ20190315rel,2019-03-15, 76ers,Zhaire Smith, placed on IL
TrentG20190315rel,2019-03-15, Blazers,Gary Trent Jr., placed on IL
HarklessM20190315rel,2019-03-15, Blazers,Maurice Harkless, placed on IL with left knee injury
DiVincenzoD20190315rel,2019-03-15, Bucks,Donte DiVincenzo, heel injury (out for season)
ZellerC20190315rel,2019-03-15, Hornets,Cody Zeller, placed on IL with sore left knee (out for season)
MackS20190315rel,2019-03-15, Hornets,Shelvin Mack, placed on IL
ExumD20190315rel,2019-03-15, Jazz,Dante Exum, right knee injury (out for season)
SmithD20190315rel,2019-03-15, Knicks,Dennis Smith Jr., placed on IL with sore lower back
HezonjaM20190315rel,2019-03-15, Knicks,Mario Hezonja, placed on IL with bruised left leg
HartJ20190315rel,2019-03-15, Lakers,Josh Hart, right knee tendinitis (DTD)
JamesL20190315rel,2019-03-15, Lakers,LeBron James, placed on IL
CrabbeA20190315rel,2019-03-15, Nets,Allen Crabbe, sore right knee (out for season)
MykhailiukS20190315rel,2019-03-15, Pistons,Sviatoslav Mykhailiuk, placed on IL
JohnsonT20190315rel,2019-03-15, Suns,Tyler Johnson, sore right knee (DTD)
BrogdonM20190316rel,2019-03-16, Bucks,Malcolm Brogdon, right foot injury (DTD)
YabuseleG20190316rel,2019-03-16, Celtics,Guerschon Yabusele, placed on IL with illness
ExumD20190316rel,2019-03-16, Jazz,Dante Exum, placed on IL with right knee injury (out for season)
SefoloshaT20190316rel,2019-03-16, Jazz,Thabo Sefolosha, placed on IL with left hamstring injury
DoncicL20190316rel,2019-03-16, Mavericks,Luka Doncic, placed on IL with bruised right knee
CrabbeA20190316rel,2019-03-16, Nets,Allen Crabbe, placed on IL with sore right knee (out for season)
NapierS20190316rel,2019-03-16, Nets,Shabazz Napier, placed on IL with right hamstring injury
HolmesR20190316rel,2019-03-16, Suns,Richaun Holmes, strained right quadriceps (DTD)
McCollumC20190317rel,2019-03-17, Blazers,C.J. McCollum, left knee injury (DTD)
BrogdonM20190317rel,2019-03-17, Bucks,Malcolm Brogdon, placed on IL with right foot injury
WinslowJ20190317rel,2019-03-17, Heat,Justise Winslow, placed on IL with bruised right thigh
VonlehN20190317rel,2019-03-17, Knicks,Noah Vonleh, placed on IL with sprained right ankle (out for season)
StephensonL20190317rel,2019-03-17, Lakers,Lance Stephenson, placed on IL with sprained toe
WilliamsA20190317rel,2019-03-17, Nets,Alan Williams, placed on IL
McCollumC20190318rel,2019-03-18, Blazers,C.J. McCollum, placed on IL with left knee injury
PorterO20190318rel,2019-03-18, Bulls,Otto Porter Jr., placed on IL with strained rotator cuff in right shoulder (out for season)
LoveK20190318rel,2019-03-18, Cavaliers,Kevin Love, bruised lower back (DTD)
HaywardG20190318rel,2019-03-18, Celtics,Gordon Hayward, placed on IL with concussion
McGruderR20190318rel,2019-03-18, Heat,Rodney McGruder, placed on IL with sore left knee
AntetokounmpoK20190318rel,2019-03-18, Mavericks,Kostas Antetokounmpo, placed on IL
GriffinB20190318rel,2019-03-18, Pistons,Blake Griffin, placed on IL
OubreK20190318rel,2019-03-18, Suns,Kelly Oubre Jr., placed on IL with sprained left thumb (out for season)
HolmesR20190318rel,2019-03-18, Suns,Richaun Holmes, placed on IL with strained right quadriceps
NoelN20190318rel,2019-03-18, Thunder,Nerlens Noel, bruised left quadricep (DTD)
IguodalaA20190318rel,2019-03-18, Warriors,Andre Iguodala, placed on IL with dental ailment
CousinsD20190318rel,2019-03-18, Warriors,DeMarcus Cousins, placed on IL with sore right ankle
WilliamsR20190318rel,2019-03-18, Celtics,Robert Williams III, placed on IL with illness
IlyasovaE20190319rel,2019-03-19, Bucks,Ersan Ilyasova, illness (DTD)
AntetokounmpoG20190319rel,2019-03-19, Bucks,Giannis Antetokounmpo, sprained right ankle (DTD)
GasolP20190319rel,2019-03-19, Bucks,Pau Gasol, placed on IL with sore left ankle (out for season)
MilesC20190319rel,2019-03-19, Grizzlies,C.J. Miles, left foot injury (out for season)
Tony(20190319rel,2019-03-19, Hornets,(William) Tony Parker, placed on IL
JamesL20190319rel,2019-03-19, Lakers,LeBron James, placed on IL with left groin injury
NapierS20190319rel,2019-03-19, Nets,Shabazz Napier, placed on IL with illness
CollisonD20190319rel,2019-03-19, Pacers,Darren Collison, placed on IL with bruised right quadriceps
RoseD20190319rel,2019-03-19, Timberwolves,Derrick Rose, placed on IL with sore right elbow (out for season)
HillG20190320rel,2019-03-20, Bucks,George Hill, left groin injury (DTD)
MiroticN20190320rel,2019-03-20, Bucks,Nikola Mirotic, placed on IL with fractured left thumb
LaVineZ20190320rel,2019-03-20, Bulls,Zach LaVine, bruised right thigh (out for season)
BradleyA20190320rel,2019-03-20, Grizzlies,Avery Bradley, right shin injury (DTD)
MilesC20190320rel,2019-03-20, Grizzlies,C.J. Miles, placed on IL with left foot injury (out for season)
Kidd-GilchristM20190320rel,2019-03-20, Hornets,Michael Kidd-Gilchrist, concussion (DTD)
TrierA20190320rel,2019-03-20, Knicks,Allonzo Trier, placed on IL with strained left calf (out for season)
AllenK20190320rel,2019-03-20, Knicks,Kadeem Allen, illness (DTD)
KleberM20190320rel,2019-03-20, Mavericks,Maximilian Kleber, placed on IL with sprained left wrist
DavisA20190320rel,2019-03-20, Pelicans,Anthony Davis, personal reasons (DTD)
LowryK20190320rel,2019-03-20, Raptors,Kyle Lowry, placed on IL with sprained right ankle
FariedK20190320rel,2019-03-20, Rockets,Kenneth Faried, sore left knee (DTD)
McRaeJ20190320rel,2019-03-20, Wizards,Jordan McRae, placed on IL
HardawayT20190321rel,2019-03-21, Mavericks,Tim Hardaway Jr., placed on IL with tibia injury (out for season)
JohnsonT20190321rel,2019-03-21, Suns,Tyler Johnson, placed on IL with sore right knee (out for season)
GibsonT20190321rel,2019-03-21, Timberwolves,Taj Gibson, strained left calf (DTD)
ArizaT20190321rel,2019-03-21, Wizards,Trevor Ariza, strained left groin (DTD)
HorfordA20190322rel,2019-03-22, Celtics,Al Horford, sore left knee (DTD)
BaynesA20190322rel,2019-03-22, Celtics,Aron Baynes, sprained left ankle (DTD)
BradleyA20190322rel,2019-03-22, Grizzlies,Avery Bradley, placed on IL with right shin injury (out for season)
NoahJ20190322rel,2019-03-22, Grizzlies,Joakim Noah, sore right knee (DTD)
ConleyM20190322rel,2019-03-22, Grizzlies,Mike Conley Jr., general soreness (DTD)
HartJ20190322rel,2019-03-22, Lakers,Josh Hart, placed on IL with right knee tendinitis (out for season)
MuscalaM20190322rel,2019-03-22, Lakers,Mike Muscala, placed on IL with sore right ankle
FrazierM20190322rel,2019-03-22, Magic,Melvin Frazier Jr., placed on IL
BoucherC20190322rel,2019-03-22, Raptors,Chris Boucher, placed on IL
HutchisonC20190323rel,2019-03-23, Bulls,Chandler Hutchison, toe injury (out for season)
